{
  "schema_version": "1.0",
  "part": {
    "name": "magic_wand_rear_nonconductive_end_cap_prototype",
    "id": "MW-M-003",
    "units": "mm",
    "origin": [
      0,
      0,
      0
    ],
    "tolerance": 0.001,
    "domain": "mechanical",
    "locks": [
      "review_only_prototype",
      "native_topology_requires_host_reopen",
      "manufacturing_release_forbidden"
    ],
    "review_policy": {
      "reviewOnly": true,
      "accepted": false,
      "ruleEnabled": false,
      "domainGated": true
    }
  },
  "engineering_normative_preflight": {
    "schema": "aicad_engineering_normative_preflight_v1",
    "contractId": "MW_MECHANICAL_CONTROLLED_GENERATION_PREFLIGHT_A",
    "revision": 1,
    "domain": "mechanical",
    "deliveryStage": "review",
    "canonicalRulesSchema": "aicad_production_readiness_rules_v3",
    "canonicalRulesVersion": "3.0.0",
    "authorityOrder": [
      "selected_standard",
      "approved_engineering_input",
      "user_explicit_numeric",
      "user_explicit_semantic",
      "reference_cad",
      "reference_image",
      "inferred_assumption"
    ],
    "sources": [
      {
        "id": "STD_AUTHORITY",
        "kind": "selected_standard",
        "description": "Controlled review-scope selection of the canonical mechanical standards ledger; compliance is not asserted.",
        "path": "authority/selected-standards-scope.json",
        "size": 2090,
        "sha256": "95b44981555d43251649ce670660e93c023c583a5ad7c7ecabca179ee94ac05e",
        "mediaType": "application/json",
        "authorityRevision": "MW-MECH-STD-001-A"
      },
      {
        "id": "ENG_INPUT",
        "kind": "approved_engineering_input",
        "description": "Task-authorized controlled prototype design basis; external professional release approval is outside this authority.",
        "path": "authority/engineering-design-basis.json",
        "size": 4441,
        "sha256": "35cc4fe53b8f6905a719b90f815339235b24f1404ff4f6e4c57a4d6aa4baab79",
        "mediaType": "application/json",
        "authorityRevision": "MW-MECH-DB-001-A"
      }
    ],
    "applicableStandards": [
      {
        "standard": "ISO 8015:2011",
        "status": "published",
        "applicability": "GPS fundamentals",
        "sourceId": "STD_AUTHORITY",
        "scopeDecision": "Selected for review-stage GPS and drawing control only; obtain a controlled copy and confirm edition, scope and jurisdiction before release."
      },
      {
        "standard": "ISO 14405-1:2025",
        "status": "published",
        "applicability": "dimensional tolerancing",
        "sourceId": "STD_AUTHORITY",
        "scopeDecision": "Selected for review-stage GPS and drawing control only; obtain a controlled copy and confirm edition, scope and jurisdiction before release."
      },
      {
        "standard": "ISO 5459:2024",
        "status": "published",
        "applicability": "datums and datum systems",
        "sourceId": "STD_AUTHORITY",
        "scopeDecision": "Selected for review-stage GPS and drawing control only; obtain a controlled copy and confirm edition, scope and jurisdiction before release."
      },
      {
        "standard": "ISO 1101:2017",
        "status": "published",
        "applicability": "geometrical tolerancing",
        "sourceId": "STD_AUTHORITY",
        "scopeDecision": "Selected for review-stage GPS and drawing control only; obtain a controlled copy and confirm edition, scope and jurisdiction before release."
      },
      {
        "standard": "ISO 22081:2021",
        "status": "published",
        "applicability": "general geometrical and size specifications",
        "sourceId": "STD_AUTHORITY",
        "scopeDecision": "Selected for review-stage GPS and drawing control only; obtain a controlled copy and confirm edition, scope and jurisdiction before release."
      },
      {
        "standard": "ISO 13715:2017",
        "status": "published",
        "applicability": "edges of undefined shape",
        "sourceId": "STD_AUTHORITY",
        "scopeDecision": "Selected for review-stage GPS and drawing control only; obtain a controlled copy and confirm edition, scope and jurisdiction before release."
      },
      {
        "standard": "ISO 21920-1:2021",
        "status": "published",
        "applicability": "surface texture indication",
        "sourceId": "STD_AUTHORITY",
        "scopeDecision": "Selected for review-stage GPS and drawing control only; obtain a controlled copy and confirm edition, scope and jurisdiction before release."
      },
      {
        "standard": "ISO 1:2022",
        "status": "published",
        "applicability": "reference temperature for specification and verification",
        "sourceId": "STD_AUTHORITY",
        "scopeDecision": "Selected for review-stage GPS and drawing control only; obtain a controlled copy and confirm edition, scope and jurisdiction before release."
      },
      {
        "standard": "ISO 2768-1:1989",
        "status": "published",
        "applicability": "general linear and angular tolerances when invoked",
        "sourceId": "STD_AUTHORITY",
        "scopeDecision": "Selected for review-stage GPS and drawing control only; obtain a controlled copy and confirm edition, scope and jurisdiction before release."
      },
      {
        "standard": "ISO 286-1:2010",
        "status": "published",
        "applicability": "limits and fits basis when invoked",
        "sourceId": "STD_AUTHORITY",
        "scopeDecision": "Selected for review-stage GPS and drawing control only; obtain a controlled copy and confirm edition, scope and jurisdiction before release."
      },
      {
        "standard": "ISO 286-2:2010",
        "status": "published",
        "applicability": "limit deviations for holes and shafts when invoked",
        "sourceId": "STD_AUTHORITY",
        "scopeDecision": "Selected for review-stage GPS and drawing control only; obtain a controlled copy and confirm edition, scope and jurisdiction before release."
      },
      {
        "standard": "ISO 965-1:2026",
        "status": "published",
        "applicability": "metric thread tolerances when invoked",
        "sourceId": "STD_AUTHORITY",
        "scopeDecision": "Selected for review-stage GPS and drawing control only; obtain a controlled copy and confirm edition, scope and jurisdiction before release."
      },
      {
        "standard": "ISO 898-1:2013",
        "status": "published",
        "applicability": "steel fastener properties when invoked",
        "sourceId": "STD_AUTHORITY",
        "scopeDecision": "Selected for review-stage GPS and drawing control only; obtain a controlled copy and confirm edition, scope and jurisdiction before release."
      },
      {
        "standard": "ISO 16047:2005+Amd 1:2012",
        "status": "published",
        "applicability": "fastener torque-clamp testing when invoked",
        "sourceId": "STD_AUTHORITY",
        "scopeDecision": "Selected for review-stage GPS and drawing control only; obtain a controlled copy and confirm edition, scope and jurisdiction before release."
      }
    ],
    "ruleApplications": [
      {
        "gatePath": "mechanical.intent.wholeIntent",
        "disposition": "constrained",
        "requirement": "Resolve canonical gate mechanical.intent.wholeIntent before controlled generation. The generated design and its later evidence plan must bind /intent/wholeIntent to the rule-owned expected value true.",
        "canonicalGateSha256": "a86804e245f560d2a7539890fd601a66304811feb9b277089b816a5ac8935582",
        "sourceIds": [
          "STD_AUTHORITY",
          "ENG_INPUT"
        ],
        "standardIds": [
          "ISO 8015:2011"
        ],
        "verificationMethod": "Run the deterministic package tests and AICAD validator, compare source hashes, and retain human engineering review as a separate gate.",
        "verifierId": "canonical_rule_check",
        "generationConstraint": "Bind this canonical gate to MW-MECH-DB-001 and MW-MECH-STD-001, preserve review-only locks, and verify the parameter-derived plan and evidence manifest before allowing the next controlled generation stage."
      },
      {
        "gatePath": "mechanical.intent.dimensionalAuthority",
        "disposition": "constrained",
        "requirement": "Resolve canonical gate mechanical.intent.dimensionalAuthority before controlled generation. The generated design and its later evidence plan must bind /intent/dimensionalAuthority to the rule-owned expected value true.",
        "canonicalGateSha256": "879fae881a20f92c7953f4345c19a072045002de8ce2b7ad224ee65257ffaac6",
        "sourceIds": [
          "STD_AUTHORITY",
          "ENG_INPUT"
        ],
        "standardIds": [
          "ISO 8015:2011"
        ],
        "verificationMethod": "Run the deterministic package tests, then inspect the listed critical characteristic with the method in ASSEMBLY_DFM_TEST.md.",
        "verifierId": "canonical_rule_check",
        "generationConstraint": "Drive every critical dimension from design-parameters.json, use datum A rear plane, datum B common axis and datum C actuator radial plane, and retain explicit inspection limits without inferring production capability."
      },
      {
        "gatePath": "mechanical.intent.materialAuthority",
        "disposition": "constrained",
        "requirement": "Resolve canonical gate mechanical.intent.materialAuthority before controlled generation. The generated design and its later evidence plan must bind /intent/materialAuthority to the rule-owned expected value true.",
        "canonicalGateSha256": "ae4a7838939af15079be8a77a4a7dae5bbf146128993313a9ad508df506b9f60",
        "sourceIds": [
          "STD_AUTHORITY",
          "ENG_INPUT"
        ],
        "standardIds": [